{
 "id": "ccas.264400441",
 "label": "CCAS CARQUEFOU (264400441)",
 "montant": null,
 "annee": 2024,
 "statut": "confirme",
 "bloc_univers": "APUL.odal",
 "volet": "mixte",
 "base_comptable": "OFGL",
 "niveaux": [
  "P2",
  "P2",
  "P2",
  null,
  null,
  null
 ],
 "description": "Fiche de centre d'action sociale (ADR-0004) — CCAS CARQUEFOU, code 264400441. Comptes 2024 exécutés, CONSOLIDÉS (budget principal et budgets annexes). Le montant racine est volontairement null : les dépenses (429 014,14 €) et les recettes (163 985,69 €) ne s'additionnent pas.",
 "source": {
  "nom": "OFGL — Comptes des CCAS et CIAS (jeu ofgl-base-ccas-cias), comptes consolidés, exercice 2024",
  "url": "https://data.ofgl.fr/explore/dataset/ofgl-base-ccas-cias/",
  "producteur": "OFGL / DGFiP",
  "licence": "Licence Ouverte 2.0",
  "consulte_le": "2026-07-20",
  "maj": "2026-07-20"
 },
 "enfants": [
  {
   "id": "ccas.264400441.depenses",
   "label": "Dépenses 2024 (comptes consolidés)",
   "montant": 429014.14,
   "annee": 2024,
   "statut": "confirme",
   "source": {
    "nom": "OFGL — Comptes des CCAS et CIAS (jeu ofgl-base-ccas-cias), comptes consolidés, exercice 2024, agrégat « Dépenses totales »",
    "url": "https://data.ofgl.fr/explore/dataset/ofgl-base-ccas-cias/",
    "producteur": "OFGL / DGFiP",
    "licence": "Licence Ouverte 2.0",
    "consulte_le": "2026-07-20",
    "maj": "2026-07-20"
   },
   "enfants": [],
   "description": "Total seul : la somme des sections fonctionnement et investissement publiée par la source ne reconstitue pas ce total. Aucune ventilation n'est affichée plutôt qu'une ventilation fausse."
  },
  {
   "id": "ccas.264400441.recettes",
   "label": "Recettes 2024 (comptes consolidés)",
   "montant": 163985.69,
   "annee": 2024,
   "statut": "confirme",
   "source": {
    "nom": "OFGL — Comptes des CCAS et CIAS (jeu ofgl-base-ccas-cias), comptes consolidés, exercice 2024, agrégat « Recettes totales »",
    "url": "https://data.ofgl.fr/explore/dataset/ofgl-base-ccas-cias/",
    "producteur": "OFGL / DGFiP",
    "licence": "Licence Ouverte 2.0",
    "consulte_le": "2026-07-20",
    "maj": "2026-07-20"
   },
   "enfants": [
    {
     "id": "ccas.264400441.recettes.fonctionnement",
     "label": "Recettes de fonctionnement",
     "montant": 163876.3,
     "annee": 2024,
     "statut": "confirme",
     "source": {
      "nom": "OFGL — Comptes des CCAS et CIAS (jeu ofgl-base-ccas-cias), comptes consolidés, exercice 2024, agrégat « Recettes de fonctionnement »",
      "url": "https://data.ofgl.fr/explore/dataset/ofgl-base-ccas-cias/",
      "producteur": "OFGL / DGFiP",
      "licence": "Licence Ouverte 2.0",
      "consulte_le": "2026-07-20",
      "maj": "2026-07-20"
     },
     "enfants": []
    },
    {
     "id": "ccas.264400441.recettes.investissement",
     "label": "Recettes d'investissement",
     "montant": 109.39,
     "annee": 2024,
     "statut": "confirme",
     "source": {
      "nom": "OFGL — Comptes des CCAS et CIAS (jeu ofgl-base-ccas-cias), comptes consolidés, exercice 2024, agrégat « Recettes d'investissement »",
      "url": "https://data.ofgl.fr/explore/dataset/ofgl-base-ccas-cias/",
      "producteur": "OFGL / DGFiP",
      "licence": "Licence Ouverte 2.0",
      "consulte_le": "2026-07-20",
      "maj": "2026-07-20"
     },
     "enfants": []
    }
   ]
  }
 ]
}
