{
 "id": "ccas.264603325",
 "label": "EHPAD PETIT BOIS-PA-CCAS PRADINES (264603325)",
 "montant": null,
 "annee": 2024,
 "statut": "confirme",
 "bloc_univers": "APUL.odal",
 "volet": "mixte",
 "niveaux": [
  "P2",
  "P2",
  "P2",
  null,
  null,
  null
 ],
 "description": "Fiche de centre d'action sociale (ADR-0004) — EHPAD PETIT BOIS-PA-CCAS PRADINES, code 264603325. Comptes 2024 exécutés, CONSOLIDÉS (budget principal et budgets annexes). Le montant racine est volontairement null : les dépenses (469 028,57 €) et les recettes (3 732 592,30 €) ne s'additionnent pas.",
 "source": {
  "nom": "OFGL — Comptes des CCAS et CIAS (jeu ofgl-base-ccas-cias), comptes consolidés, exercice 2024",
  "url": "https://data.ofgl.fr/explore/dataset/ofgl-base-ccas-cias/",
  "producteur": "OFGL / DGFiP",
  "licence": "Licence Ouverte 2.0",
  "consulte_le": "2026-07-20",
  "maj": "2026-07-20"
 },
 "enfants": [
  {
   "id": "ccas.264603325.depenses",
   "label": "Dépenses 2024 (comptes consolidés)",
   "montant": 469028.57,
   "annee": 2024,
   "statut": "confirme",
   "source": {
    "nom": "OFGL — Comptes des CCAS et CIAS (jeu ofgl-base-ccas-cias), comptes consolidés, exercice 2024, agrégat « Dépenses totales »",
    "url": "https://data.ofgl.fr/explore/dataset/ofgl-base-ccas-cias/",
    "producteur": "OFGL / DGFiP",
    "licence": "Licence Ouverte 2.0",
    "consulte_le": "2026-07-20",
    "maj": "2026-07-20"
   },
   "enfants": [],
   "description": "Total seul : la somme des sections fonctionnement et investissement publiée par la source ne reconstitue pas ce total. Aucune ventilation n'est affichée plutôt qu'une ventilation fausse."
  },
  {
   "id": "ccas.264603325.recettes",
   "label": "Recettes 2024 (comptes consolidés)",
   "montant": 3732592.3,
   "annee": 2024,
   "statut": "confirme",
   "source": {
    "nom": "OFGL — Comptes des CCAS et CIAS (jeu ofgl-base-ccas-cias), comptes consolidés, exercice 2024, agrégat « Recettes totales »",
    "url": "https://data.ofgl.fr/explore/dataset/ofgl-base-ccas-cias/",
    "producteur": "OFGL / DGFiP",
    "licence": "Licence Ouverte 2.0",
    "consulte_le": "2026-07-20",
    "maj": "2026-07-20"
   },
   "enfants": [],
   "description": "Total seul : la somme des sections fonctionnement et investissement publiée par la source ne reconstitue pas ce total. Aucune ventilation n'est affichée plutôt qu'une ventilation fausse."
  }
 ]
}
