{
 "id": "ccas.266208420",
 "label": "CCAS VENDIN-LE-VIEIL (266208420)",
 "montant": null,
 "annee": 2024,
 "statut": "confirme",
 "bloc_univers": "APUL.odal",
 "volet": "mixte",
 "base_comptable": "OFGL",
 "niveaux": [
  "P2",
  "P2",
  "P2",
  null,
  null,
  null
 ],
 "description": "Fiche de centre d'action sociale (ADR-0004) — CCAS VENDIN-LE-VIEIL, code 266208420. Comptes 2024 exécutés, CONSOLIDÉS (budget principal et budgets annexes). Le montant racine est volontairement null : les dépenses (707 490,30 €) et les recettes (458 645,27 €) ne s'additionnent pas.",
 "source": {
  "nom": "OFGL — Comptes des CCAS et CIAS (jeu ofgl-base-ccas-cias), comptes consolidés, exercice 2024",
  "url": "https://data.ofgl.fr/explore/dataset/ofgl-base-ccas-cias/",
  "producteur": "OFGL / DGFiP",
  "licence": "Licence Ouverte 2.0",
  "consulte_le": "2026-07-20",
  "maj": "2026-07-20"
 },
 "enfants": [
  {
   "id": "ccas.266208420.depenses",
   "label": "Dépenses 2024 (comptes consolidés)",
   "montant": 707490.3,
   "annee": 2024,
   "statut": "confirme",
   "source": {
    "nom": "OFGL — Comptes des CCAS et CIAS (jeu ofgl-base-ccas-cias), comptes consolidés, exercice 2024, agrégat « Dépenses totales »",
    "url": "https://data.ofgl.fr/explore/dataset/ofgl-base-ccas-cias/",
    "producteur": "OFGL / DGFiP",
    "licence": "Licence Ouverte 2.0",
    "consulte_le": "2026-07-20",
    "maj": "2026-07-20"
   },
   "enfants": [
    {
     "id": "ccas.266208420.depenses.fonctionnement",
     "label": "Dépenses de fonctionnement",
     "montant": 685821.24,
     "annee": 2024,
     "statut": "confirme",
     "source": {
      "nom": "OFGL — Comptes des CCAS et CIAS (jeu ofgl-base-ccas-cias), comptes consolidés, exercice 2024, agrégat « Dépenses de fonctionnement »",
      "url": "https://data.ofgl.fr/explore/dataset/ofgl-base-ccas-cias/",
      "producteur": "OFGL / DGFiP",
      "licence": "Licence Ouverte 2.0",
      "consulte_le": "2026-07-20",
      "maj": "2026-07-20"
     },
     "enfants": [
      {
       "id": "ccas.266208420.depenses.fonctionnement.personnel",
       "label": "Frais de personnel",
       "montant": 257064.35,
       "annee": 2024,
       "statut": "confirme",
       "source": {
        "nom": "OFGL — Comptes des CCAS et CIAS (jeu ofgl-base-ccas-cias), comptes consolidés, exercice 2024, agrégat « Frais de personnel »",
        "url": "https://data.ofgl.fr/explore/dataset/ofgl-base-ccas-cias/",
        "producteur": "OFGL / DGFiP",
        "licence": "Licence Ouverte 2.0",
        "consulte_le": "2026-07-20",
        "maj": "2026-07-20"
       },
       "enfants": []
      },
      {
       "id": "ccas.266208420.depenses.fonctionnement.achats",
       "label": "Achats et charges externes",
       "montant": 353265.82,
       "annee": 2024,
       "statut": "confirme",
       "source": {
        "nom": "OFGL — Comptes des CCAS et CIAS (jeu ofgl-base-ccas-cias), comptes consolidés, exercice 2024, agrégat « Achats et charges externes »",
        "url": "https://data.ofgl.fr/explore/dataset/ofgl-base-ccas-cias/",
        "producteur": "OFGL / DGFiP",
        "licence": "Licence Ouverte 2.0",
        "consulte_le": "2026-07-20",
        "maj": "2026-07-20"
       },
       "enfants": []
      },
      {
       "id": "ccas.266208420.depenses.fonctionnement.intervention",
       "label": "Dépenses d'intervention",
       "montant": 0.0,
       "annee": 2024,
       "statut": "confirme",
       "source": {
        "nom": "OFGL — Comptes des CCAS et CIAS (jeu ofgl-base-ccas-cias), comptes consolidés, exercice 2024, agrégat « Dépenses d'intervention »",
        "url": "https://data.ofgl.fr/explore/dataset/ofgl-base-ccas-cias/",
        "producteur": "OFGL / DGFiP",
        "licence": "Licence Ouverte 2.0",
        "consulte_le": "2026-07-20",
        "maj": "2026-07-20"
       },
       "enfants": []
      },
      {
       "id": "ccas.266208420.depenses.fonctionnement.autres",
       "label": "Autres dépenses de fonctionnement",
       "montant": 1022.01,
       "annee": 2024,
       "statut": "confirme",
       "source": {
        "nom": "OFGL — Comptes des CCAS et CIAS (jeu ofgl-base-ccas-cias), comptes consolidés, exercice 2024, agrégat « Autres dépenses de fonctionnement »",
        "url": "https://data.ofgl.fr/explore/dataset/ofgl-base-ccas-cias/",
        "producteur": "OFGL / DGFiP",
        "licence": "Licence Ouverte 2.0",
        "consulte_le": "2026-07-20",
        "maj": "2026-07-20"
       },
       "enfants": []
      },
      {
       "id": "ccas.266208420.depenses.fonctionnement.charges-financieres",
       "label": "Charges financières",
       "montant": 0.0,
       "annee": 2024,
       "statut": "confirme",
       "source": {
        "nom": "OFGL — Comptes des CCAS et CIAS (jeu ofgl-base-ccas-cias), comptes consolidés, exercice 2024, agrégat « Charges financières »",
        "url": "https://data.ofgl.fr/explore/dataset/ofgl-base-ccas-cias/",
        "producteur": "OFGL / DGFiP",
        "licence": "Licence Ouverte 2.0",
        "consulte_le": "2026-07-20",
        "maj": "2026-07-20"
       },
       "enfants": []
      }
     ],
     "description": "Ventilation partielle : postes principaux uniquement — la somme des enfants est inférieure au total, le reliquat correspond à d'autres agrégats OFGL non repris ici."
    },
    {
     "id": "ccas.266208420.depenses.investissement",
     "label": "Dépenses d'investissement",
     "montant": 21669.06,
     "annee": 2024,
     "statut": "confirme",
     "source": {
      "nom": "OFGL — Comptes des CCAS et CIAS (jeu ofgl-base-ccas-cias), comptes consolidés, exercice 2024, agrégat « Dépenses d'investissement »",
      "url": "https://data.ofgl.fr/explore/dataset/ofgl-base-ccas-cias/",
      "producteur": "OFGL / DGFiP",
      "licence": "Licence Ouverte 2.0",
      "consulte_le": "2026-07-20",
      "maj": "2026-07-20"
     },
     "enfants": [
      {
       "id": "ccas.266208420.depenses.investissement.equipement",
       "label": "Dépenses d'équipement",
       "montant": 20190.36,
       "annee": 2024,
       "statut": "confirme",
       "source": {
        "nom": "OFGL — Comptes des CCAS et CIAS (jeu ofgl-base-ccas-cias), comptes consolidés, exercice 2024, agrégat « Dépenses d'équipement »",
        "url": "https://data.ofgl.fr/explore/dataset/ofgl-base-ccas-cias/",
        "producteur": "OFGL / DGFiP",
        "licence": "Licence Ouverte 2.0",
        "consulte_le": "2026-07-20",
        "maj": "2026-07-20"
       },
       "enfants": []
      },
      {
       "id": "ccas.266208420.depenses.investissement.remboursement-emprunts",
       "label": "Remboursements d'emprunts (hors gestion active de la dette)",
       "montant": 1478.7,
       "annee": 2024,
       "statut": "confirme",
       "source": {
        "nom": "OFGL — Comptes des CCAS et CIAS (jeu ofgl-base-ccas-cias), comptes consolidés, exercice 2024, agrégat « Remboursements d'emprunts hors GAD »",
        "url": "https://data.ofgl.fr/explore/dataset/ofgl-base-ccas-cias/",
        "producteur": "OFGL / DGFiP",
        "licence": "Licence Ouverte 2.0",
        "consulte_le": "2026-07-20",
        "maj": "2026-07-20"
       },
       "enfants": []
      },
      {
       "id": "ccas.266208420.depenses.investissement.autres",
       "label": "Autres dépenses d'investissement",
       "montant": 0.0,
       "annee": 2024,
       "statut": "confirme",
       "source": {
        "nom": "OFGL — Comptes des CCAS et CIAS (jeu ofgl-base-ccas-cias), comptes consolidés, exercice 2024, agrégat « Autres dépenses d'investissement »",
        "url": "https://data.ofgl.fr/explore/dataset/ofgl-base-ccas-cias/",
        "producteur": "OFGL / DGFiP",
        "licence": "Licence Ouverte 2.0",
        "consulte_le": "2026-07-20",
        "maj": "2026-07-20"
       },
       "enfants": []
      },
      {
       "id": "ccas.266208420.depenses.investissement.subventions-versees",
       "label": "Subventions d'équipement versées",
       "montant": 0.0,
       "annee": 2024,
       "statut": "confirme",
       "source": {
        "nom": "OFGL — Comptes des CCAS et CIAS (jeu ofgl-base-ccas-cias), comptes consolidés, exercice 2024, agrégat « Subventions d'équipement versées »",
        "url": "https://data.ofgl.fr/explore/dataset/ofgl-base-ccas-cias/",
        "producteur": "OFGL / DGFiP",
        "licence": "Licence Ouverte 2.0",
        "consulte_le": "2026-07-20",
        "maj": "2026-07-20"
       },
       "enfants": []
      }
     ]
    }
   ]
  },
  {
   "id": "ccas.266208420.recettes",
   "label": "Recettes 2024 (comptes consolidés)",
   "montant": 458645.27,
   "annee": 2024,
   "statut": "confirme",
   "source": {
    "nom": "OFGL — Comptes des CCAS et CIAS (jeu ofgl-base-ccas-cias), comptes consolidés, exercice 2024, agrégat « Recettes totales »",
    "url": "https://data.ofgl.fr/explore/dataset/ofgl-base-ccas-cias/",
    "producteur": "OFGL / DGFiP",
    "licence": "Licence Ouverte 2.0",
    "consulte_le": "2026-07-20",
    "maj": "2026-07-20"
   },
   "enfants": [],
   "description": "Total seul : la somme des sections fonctionnement et investissement publiée par la source ne reconstitue pas ce total. Aucune ventilation n'est affichée plutôt qu'une ventilation fausse."
  }
 ]
}
